,subj,rel,obj,ref
8,Vagus Nerve Stimulation (VNS),treatment options,resistant depression,VNS be a therapeutic method that have been used for the last sixteen years to treat resistant unilateral or bipolar depression.
9,Physical exercise,recommendation,as adjunct to other anti-depressive treatments,"However, exercise be considered an adjunct to other anti-depressive treatments."
10,Mindfulness-Based Cognitive Therapy (MBCT),Potential alternative, to reduce or even stop antidepressant treatment without increasing the risk of depressive recurrence,"thus, it be a potential alternative to reduce, or even stop, antidepressant treatment without increasing the risk of depressive recurrence."
11,Transcranial Direct Current Stimulation (tDCS),less effective,than antidepressants and Repetitive Transcranial Magnetic Stimulation (rTMS) for the acute treatment of major depression,"However, its effect remains lower than that of antidepressants[133] and rTMS[134]."
0,"Mirtazapine, Escitalopram, Venlafaxine, Sertraline",More effective,"Duloxetine, Fluoxetine, Fluvoxamine, Paroxetine, Reboxetine","Mirtazapine, escitalopram, venlafaxine, and sertraline be significantly more efficacious than duloxetine (odd ratio [OR] 1·39, 1·33, 1·30 and 1·27, respectively), fluoxetine (1·37, 1·32, 1·28, and 1·25, respectively), fluvoxamine (1·41, 1·35, 1·30, and 1·27, respectively), paroxetine (1·35, 1·30, 1·27, and 1·22, respectively), and reboxetine (2·03, 1·95, 1·89, and 1·85, respectively)."
1,Escitalopram and Sertraline,Side effects,significantly fewer discontinuations,"Escitalopram and sertraline show the good profile of acceptability, leading to significantly fewer discontinuations than do duloxetine, fluvoxamine, paroxetine, reboxetine, and venlafaxine."
2,Reboxetine,Less effective,all the other antidepressants tested,Reboxetine was significantly less efficacious than all the other antidepressants tested.
3,Escitalopram and Sertraline,Highly effective,moderate to severe major depression in adults,"Sertraline might be the best choice when starting treatment for moderate to severe major depression in adults because it has the most favourable balance between benefits, acceptability, and acquisition cost."
4,Sertraline,Comparable to,Escitalopram,Sertraline seems to be preferable to escitalopram because of its lower cost in most countries.
5,Reboxetine,Not effective,routine first-line acute treatment for major depression,Reboxetine should not be used as a routine first-line acute treatment for major depression.
6,Duloxetine and Paroxetine,Side effects,less well tolerated than Escitalopram and Sertraline,"In terms of acceptability, duloxetine and paroxetine were less well tolerated than escitalopram and sertraline."
7,"Mirtazapine, Escitalopram, Venlafaxine, Sertraline",More eﬀicacious,Fluoxetine,"Mirtazapine, escitalopram, venlafaxine, and sertraline were more eﬀicacious than ﬂuoxetine, and ﬂuoxetine was more eﬀicacious than reboxetine"
0,Anxious depression,Definition,Major depressive disorder with clinically meaningful levels of anxiety,about half of outpatient with major depressive disorder also have clinically meaningful level of anxiety.
1,Anxious depression,Symptom,"greater severity of depressive illness, greater functional impairment, greater illness chronicity, increased risk of suicidality","in patient with high level of anxiety accompany major depression, greater severity of depressive illness and functional impairment, greater illness chronicity, and an increase risk of suicidality have been reported."
2,Anxious depression,More common than,"nonanxious depression in African American group, Hispanics, Primary Care Patients, Unemployed, Married then Divorced/Widowed, Less Education, Public insurance, Lower-income","anxious depression be significantly more common than nonanxious depression among african americans than in other racial/ethnic group; among hispanic than non-hispanic; among those see in primary care setting than those in psychiatric care setting; among those who be unemployed than those who be employ; among those who be marrie, divorced, or widow than among those who have never marry; and among those with less education, those with public insurance, and those with less income."
3,Anxious depression,Side effects,greater reduction in anxiety/somatization score yet greater residual symptoms of anxiety/somatization than nonanxious depression,"patient with anxious depression have a greater reduction in anxiety/somatization score than those with nonanxious depression, but they also have greater residual symptoms of anxiety/somatization at endpoint than those without anxious depression."
4,Anxious depression,side effects,"high mean QIDS-SR score at exit, low raw QID-SR change score, low percentage change in QIDS-SR score than nonanxious depression","in addition, the anxious depression group have significantly high mean QIDS-SR score at exit and significantly low raw QID-SR change score and percentage change in QIDS-SR score than the nonanxious depression group."
5,Citalopram,first-line treatment,Major depressive disorder,"a total of 2,876 adult outpatient with major depressive disorder, enroll from 18 primary and 23 psychiatric care site, receive citalopram in level 1 of star*d."
6,Anxious depression,Less commonly used,adequate dose of citalopram due to side effects or patient’s choice,"moreover, although the average citalopram dosage do not differ, time on the final dosage be short in the anxious than in the nonanxious depression group."
7,Anxious depression,Associated with,poor acute outcome following antidepressant treatment compared to nonanxious depression,anxious depression be associate with poor acute outcome than nonanxious depression following antidepressant treatment.
