,subjsummary,subj,rel,obj,objsummary,ref
1,anxious depression,anxious depression,associated with,"greater likelihood of reported suicidal ideation, personal history of attempted suicide, family history of drug abuse","suicidal ideation, attempted suicide, drug abuse","anxious depression be associated with a great likelihood of reported suicidal ideation on the ham - d, a personal history of attempted suicide, and a family history of drug abuse."
2,anxious depression,anxious depression,associated with,more medical comorbidity,medical comorbidity,patient with anxious depression be significantly more likely than those with nonanxious depression to have more medical comorbidity.
3,citalopram,citalopram,treats,major depressive disorder,major depressive disorder,"overall, they also take long to remit. this association between anxious depression and poor treatment outcome with citalopram hold true regardless of how we define anxious depression."
4,anxious depression,anxious depression,results,lower remission and response rates with citalopram treatment,lower remission/response rates,"remission rate be significantly lower in patient with anxious depression, according to both the ham - d criterion (22.2 % versus 33.4 % ) and the qids - sr criterion (27.5 % versus 38.9 %). response rates were also significantly lower for patient with anxious depression (41.7 % versus 52.8 %)."
5,anxious depression,anxious depression,associated with,"greater frequency, intensity, and burden of side effects than nonanxious depression",greater side effects,"the anxious depression group have greater frequency, intensity, and burden of side effects than the nonanxious depression group, as well as more serious adverse event."
6,anxious depression,anxious depression,associated with,more psychiatric and general medical comorbidities,psychiatric/medical comorbidities,"individual with anxious major depressive disorder be more likely to meet psychiatric diagnostic screening questionnaire criterion for generalize anxiety disorder, panic disorder, social phobia, obsessive-compulsive disorder, posttraumatic stress disorder, agoraphobia, hypochondriasis, and somatoform disorder and to have a greater overall number of comorbid axis i condition."
0,anxious depression,anxious depression,more common than,nonanxious depression,nonanxious depression,"anxious depression --> more common than -> nonanxious depression -> in -> african american group, hispanics, primary care patients, unemployed, married then divorced/widowed, less, education, public insurance, lower-income"
1,anxious depression,anxious depression,associated with,higher side effect burden,higher side effect burden,"side effect frequency, intensity, and burden in level 1 be great among patient with anxious depression thanamong those with nonanxious depression"
2,anxious depression,anxious depression,associated with,serious adverse events,serious adverse events,"as be serious adverse event, include those of a psychiatric nature"
3,anxious depression,anxious depression,less effective,antidepressant treatment,antidepressant treatment,patient with this subtype be less likely to achieve remission than those with nonanxious depression after antidepressant treatment
4,remission,remission,benefits,patients without residual symptoms,patients without residual symptoms,this study have several implication for the recognition and diagnosis ofanxious depression
5,anxious depression,anxious depression,definition,subtype of major depressive disorder,subtype of mdd,our result also suggestthe need for additional emphasis on the measurement ofsymptom of anxiety during the acute management ofpatient with major depression
6,ham-d,ham-d,definition,measure severity of anxiety symptoms,measure of anxiety symptoms,our definition of anxious depression be base onthe severity of anxiety symptom as measure by the ham - d anxiety / somatization factor
7,citalopram,citalopram,treats,anxious depression,anxious depression,both time in treatment and time on the final citalopram dosage be significantly low in the anxiousthan in the nonanxious depression group
8,benzodiazepine,benzodiazepine,treats,worsening of insomnia and nervousness in anxious depression,insomnia and nervousness,"a benzodiazepine be prescribe, which bring about a signiﬁcant improvement in her insomnia and agitation"
9,anxious depression,anxious depression,associated with,physical symptom sensitivity,physical symptom sensitivity,perhaps patient whose illness include anxious feature be more sensitive to somatic change occur during antidepressant treatment
